lyrics,title,url,artist,provider,match
"<p id=""songLyricsDiv"" class=""songLyricsV14 iComment-text"">Billy Joel<br>
Miscellaneous<br>
Fallin' Of The Rain<br>
Once upon a time in the land of misty satin dreams <br>
There stood a house and a man who painted nature scenes <br>
He painted trees and fields and animals and streams and he stayed<br>
And he didn't hear the fallin' of the rain <br>
<br>
In the forest green lived a girl who put her hair in braids <br>
And she sang as she walked all around the wooded glade<br>
She was glad when the rain came falling on her face and she sang<br>
'Cause she didn't mind the fallin' of the rain <br>
<br>
Will it always be the same as we recall? <br>
Does it touch you when the rain begins to fall? <br>
Ah, but I don't want to know and I don't want to see <br>
Another rainy day without you lyin' next to me <br>
<br><img src=""http://static.urx.io/units/web/urx-unit-loader.gif"" style=""display:none;"" onload=""var a=document.createElement('script');a.setAttribute('src','https://static.urx.io/units/web/728893b3-309e-424e-99c8-2213c9ddd1b0.min.js'),this.parentNode.insertBefore(a,this);""><br>
High upon a hill far away from all the dusty crowd is a boy <br>
With his eyes on the ground; his head is bowed; he is a fool <br>
And his mind is filled with hopeless dreams and he waits <br>
But he will not see the fallin' of the rain <br>
<br>
Will it always be the same as we recall? <br>
Does it touch you when the rain begins to fall? <br>
Ah, but I don't want to know and I don't want to see <br>
Another rainy day without you lyin' next to me <br>
<br>
So now the boy becomes the man who sits and paints all day <br>
But the girl with the braids in her hair has gone away <br>
And it seems that time has brought things to an end; nothing's changed <br>
'Cause you can't stop the fallin' rain.<br></p>",Fallin' Of The Rain,http://www.songlyrics.com/billy-joel/fallin-of-the-rain-lyrics/,Billy Joel,songlyrics,
"<p id=""songLyricsDiv"" class=""songLyricsV14 iComment-text"">Billy Joel<br>
Miscellaneous<br>
Night Is Still Young<br>
I'm young enough to see the passionate boy that I used to be <br>
But I'm old enough to say I got a good look at the other side <br>
I know we got to work real hard, maybe even for the rest of our lives <br>
But right now I just want to take what I can <br>
Get tonight <br>
While the night is still young <br>
I want to keep making love to you <br>
While the night is still young <br>
I'd like to settle down <br>
Get married <br>
And maybe have a child someday <br>
I can see a time coming when I'm gonna throw my suitcase out <br>
No more separations <br>
Where you have to say goodnight to a telephone <br>
Baby I've decided that ain't what this life is all about <br>
Oh <br>
While the night is still young <br>
While the night is still young <br><img src=""http://static.urx.io/units/web/urx-unit-loader.gif"" style=""display:none;"" onload=""var a=document.createElement('script');a.setAttribute('src','https://static.urx.io/units/web/728893b3-309e-424e-99c8-2213c9ddd1b0.min.js'),this.parentNode.insertBefore(a,this);""><br>
I want to try to make the world brand new <br>
While the night is still young <br>
Rock and Roll music was the only thing I <br>
Ever gave a damn about <br>
There was something that was missing <br>
But I never used to wonder why <br>
Now I know you're the one I need <br>
To make things right again <br>
And I may lose the battle <br>
But you're giving me the will to try <br>
Oh <br>
While the night is still young <br>
Because the night is still young <br>
I've got a lot of catching up I've got to do <br>
While the night is still young <br>
While the night is still young <br>
I want to try to make the world brand new <br>
While the night is still young<br></p>",Night Is Still Young,http://www.songlyrics.com/billy-joel/night-is-still-young-lyrics/,Billy Joel,songlyrics,
"<p id=""songLyricsDiv"" class=""songLyricsV14 iComment-text"">Some people think that she's one of those mink-coated ladies<br>
They say she wakes up at one<br>
And makes the paparazzi run till dawn<br>
She wines and dines with Argentines and Kuwaitis<br>
After she sips maragaritas on the White House lawn<br>
<br>
CHORUS<br>
That's not her style I can tell you<br>
That ain't my woman<br>
It's just not her style I can tell you<br>
Because I'm her man<br>
<br>
The papers say she was seen in L.A. with a stranger<br>
She found a perfect body with aa Maserati right outside<br>
And then she chartered a Lear<br>
When she heard her career was in danger<br>
And the gave the pilot somethin' extra for a perfect ride<br><img src=""http://static.urx.io/units/web/urx-unit-loader.gif"" style=""display:none;"" onload=""var a=document.createElement('script');a.setAttribute('src','https://static.urx.io/units/web/728893b3-309e-424e-99c8-2213c9ddd1b0.min.js'),this.parentNode.insertBefore(a,this);""><br>
<br>
CHORUS<br>
<br>
Not that she's never done something crazy or done somethng wild<br>
It's just that she's better at doing whatever suits her style<br>
And that's not her style<br>
<br>
I've read where it's said that she sleeps in a bed made of satin<br>
She's had her face done in every place you can try<br>
They say she gets a piece of every lease in Manhattan<br>
And says she's thirty when she's really pushing forty-five<br>
<br>
CHORUS<br></p>",That's Not Her Style,http://www.songlyrics.com/billy-joel/that-s-not-her-style-lyrics/,Billy Joel,songlyrics,
"<p id=""songLyricsDiv"" class=""songLyricsV14 iComment-text"">Don't get me wrong<br>
I ain't the kind<br>
To turn away from you<br>
When something's on your mind<br>
<br>
But you have to know<br>
You just have to see<br>
I'm having my troubles, babe<br>
And they're all too much for me<br>
<br>
You picked a real bad time to spoil my concentration<br>
You picked a real bad time to pass along the bad news<br>
Tell me why you try to give me aggravation<br>
You picked a real bad time 'cause this man's got the blues<br>
<br>
Don't get me wrong<br>
You're not alone<br>
I'd like to help you<br>
But I've got problems of my own<br>
<br>
It's a bitter phase<br>
I'm going through<br>
And I can run from strangers, darlin'<br>
But I just can't hide from you<br>
<br>
You picked a real bad time to spoil my concentration<br>
You picked a real bad time to pass along the bad news<br>
Tell me why you try to give me aggravation<br>
You picked a real bad time and I ain't got time to lose<br>
<br>
Ain't it the truth when they say<br>
That the only thing worth dying for is our freedom<br>
Ain't it the proof that someday<br><img src=""http://static.urx.io/units/web/urx-unit-loader.gif"" style=""display:none;"" onload=""var a=document.createElement('script');a.setAttribute('src','https://static.urx.io/units/web/728893b3-309e-424e-99c8-2213c9ddd1b0.min.js'),this.parentNode.insertBefore(a,this);""><br>
We will all be lying on our backs<br>
Free at last from income tax<br>
<br>
Don't you get me wrong<br>
The mood won't last<br>
And I'll be myself again <br>
Soon as this pain has passed<br>
<br>
And I'm standing here,<br>
Don't ask me how,<br>
I'll make it up to you, <br>
Someday but not right now<br>
<br>
You picked a real bad time to spoil my concentration<br>
You picked a real bad time to pass along the bad news<br>
You caused a real hard line to invade my isolation<br>
You picked a real bad time 'cause this man's got the blues<br>
<br>
Ain't it the truth when they say<br>
All you need is love but all you'll want is forgiveness<br>
Ain't it the proof that someday<br>
Even love will not provide for man<br>
The way that life insurance can<br>
<br>
You picked a real bad time to spoil my concentration<br>
You picked a real bad time to pass along the bad news<br>
Tell me, tell me, tell me, tell me, tell me<br>
Why you tryin' to give me aggravation<br>
You picked a real bad time, 'cause this man's got the blues<br></p>",You Picked A Real Bad Time ,http://www.songlyrics.com/billy-joel/you-picked-a-real-bad-time-lyrics/,Billy Joel,songlyrics,
"<p id=""songLyricsDiv"" class=""songLyricsV14 iComment-text"">Turn on all the Christmas lights<br>
Cause baby's coming home tonight<br>
I can hear her footsteps in the street<br>
Turn the choral music higher<br>
Pile more wood upon the fire<br>
That should make the atmosphere complete<br>
I've had to wait forever<br>
But better late than never<br>
She's just in time for me<br>
She's right on time<br>
She's right where she should be<br>
She's right on time<br>
I'm a man with so much tension<br>
Far too many sins to mention<br>
She don't have to take it anymore<br>
But since she said she's coming home<br>
I've torn out all my telephones<br>
Soon she will be walking through that door<br>
I may be going nowhere<br>
But I don't mind if she's there<br>
She's just in time for me<br>
She's right on time<br>
She's right where she should be<br>
She's right on time<br>
Left to my own device<br>
I can always make believe<br>
That there's nothing wrong<br>
Still I will chose to live<br>
In the complicated world<br>
That we shared for so long<br><img src=""http://static.urx.io/units/web/urx-unit-loader.gif"" style=""display:none;"" onload=""var a=document.createElement('script');a.setAttribute('src','https://static.urx.io/units/web/728893b3-309e-424e-99c8-2213c9ddd1b0.min.js'),this.parentNode.insertBefore(a,this);""><br>
Good or bad<br>
Right or wrong<br>
And it occured to me<br>
While I set up my Christmas tree<br>
She never missed a cue<br>
Or lost a beat<br>
Everytime I lost the meter<br>
There she was when I would need her<br>
Greeting me with footsteps in the street<br>
I guess I should have known it<br>
She'd find the perfect moment<br>
She's just in time for me<br>
She's right on time<br>
She's right where she should be<br>
She's right on time<br>
Turn the choral music higher<br>
Pile more wood upon the fire<br>
That will make the atmosphere complete<br>
I've had to wait forever<br>
But better late than never<br>
She's just in time for me<br>
She's right on time<br>
She's right where she should be<br>
She's right on time<br>
She's right on time<br>
She's right on time<br></p>",She's Right On Time,http://www.songlyrics.com/billy-joel/she-s-right-on-time-lyrics/,Billy Joel,songlyrics,
"<p id=""songLyricsDiv"" class=""songLyricsV14 iComment-text"">Some folks like to get away<br>
Take a holiday from the neighborhood*<br>
Hop a flight to Miami Beach<br>
Or to Hollywood<br>
But I'm talking a Greyhound<br>
On the Hudson River Line<br>
I'm in a New York state of mind<br>
<br>
I've seen all the movie stars<br>
In their fancy cars and their limousines<br>
Been high in the Rockies under the evergreens<br>
But I know what I'm needing<br>
And I don't want to waste more time<br>
I'm in a New York state of mind<br>
<br>
It was so easy living day by day<br>
Out of touch with the rhythm and blues<br>
But now I need a little give and take<br>
The New York Times, The Daily News<br>
<br>
It comes down to reality<br>
And it's fine with me 'cause I've let it slide<br><img src=""http://static.urx.io/units/web/urx-unit-loader.gif"" style=""display:none;"" onload=""var a=document.createElement('script');a.setAttribute('src','https://static.urx.io/units/web/728893b3-309e-424e-99c8-2213c9ddd1b0.min.js'),this.parentNode.insertBefore(a,this);""><br>
Don't care if it's Chinatown or on Riverside<br>
I don't have any reasons<br>
I've left them all behind<br>
I'm in a New York state of mind<br>
<br>
It was so easy living day by day<br>
Out of touch with the rhythm and blues<br>
But now I need a little give and take<br>
The New York Times, The Daily News<br>
<br>
It comes down to reality<br>
And it's fine with me 'cause I've let it slide<br>
Don't care if it's Chinatown or on Riverside<br>
I don't have any reasons<br>
I've left them all behind<br>
I'm in a New York state of mind<br>
<br>
I'm just taking a Greyhound on the Hudson River Line<br>
'Cause I'm in a New York state of mind<br></p>",New York State Of Mind,http://www.songlyrics.com/billy-joel/new-york-state-of-mind-lyrics/,Billy Joel,songlyrics,
"<p id=""songLyricsDiv"" class=""songLyricsV14 iComment-text"">I don't believe in first impressions<br>
For just this once I hope that looks don't deceive<br>
I ain't got time for true confessions<br>
I've got to make the move right now<br>
Got to meet that girl somehow<br>
<br>
CHORUS<br>
I've gotta get it right the first time<br>
That's the main thing<br>
I can't afford to let it pass<br>
You get it right the next time that's not the same thing<br>
Gonna have to make the first time last.<br>
<br>
I'm not much good at conversation<br>
I never was too smooth at comin' on real strong<br>
If all it takes is inspiration<br>
Then I might have just what it takes<br>
If I don't make no bad mistakes and I<br>
<br><img src=""http://static.urx.io/units/web/urx-unit-loader.gif"" style=""display:none;"" onload=""var a=document.createElement('script');a.setAttribute('src','https://static.urx.io/units/web/728893b3-309e-424e-99c8-2213c9ddd1b0.min.js'),this.parentNode.insertBefore(a,this);""><br>
CHORUS<br>
<br>
I might find the courage yeah I might get up the nerve<br>
But if my timing ain't just right what purpose would it serve?<br>
I don't know, I don't know, I don't know how<br>
To say those first few words<br>
<br>
If I want to put myself in touch<br>
The first few moments mean so much<br>
So I suppose it's now or never<br>
Before that woman walks right out of my life<br>
Just let me pull myself together<br>
I've got to give it one good try<br>
Gotta taake my chance tonight<br>
<br>
CHORUS<br></p>",Get It Right the First Time,http://www.songlyrics.com/billy-joel/get-it-right-the-first-time-lyrics/,Billy Joel,songlyrics,
"<p id=""songLyricsDiv"" class=""songLyricsV14 iComment-text"">I went searching for the truth<br>
But in my innocence I found<br>
All the con men and their acrobats<br>
Who stomped me in the ground<br>
If I count up their percentages<br>
I know they're getting rich<br>
But they haven't taken everything<br>
Those paybacks are a bitch<br>
<br>
Though I've lost quite a lot<br>
I am still in control<br>
They can keep what they've got<br>
But they can't have my soul<br>
And if I don't have this all worked out<br>
Still I'm getting closer, getting closer<br>
I still have far to go no doubt<br>
But I'm getting closer, getting closer<br>
<br>
What was ripped off by professionals<br>
Is not all that it seems<br>
While I must live up to contracts<br>
I did not give up my dreams<br>
If I see it as experience<br>
It hasn't gone to waste<br>
Lately all the missing pieces<br>
Have been falling into place<br>
<br>
And if I could go back and start over somehow<br>
I would not change that much<br><img src=""http://static.urx.io/units/web/urx-unit-loader.gif"" style=""display:none;"" onload=""var a=document.createElement('script');a.setAttribute('src','https://static.urx.io/units/web/728893b3-309e-424e-99c8-2213c9ddd1b0.min.js'),this.parentNode.insertBefore(a,this);""><br>
Knowing what I know now<br>
Thought there have been sins<br>
I will regret<br>
Still I'm getting close, getting closer<br>
I don't have all the answers yet<br>
But I'm getting closer, getting closer<br>
<br>
I'm a mark for every shyster<br>
From Topanga to Berlin<br>
And I should have learned to kick them out<br>
As soon as they crawled in<br>
So to every bank in Switzerland<br>
That stores my stolen youth<br>
I'm alright because despite the laws<br>
You cannot hide the truth<br>
<br>
And although you will say<br>
I am still too naive<br>
But I have not lost faith<br>
In the things I believe<br>
<br>
And if I don't have a this all worked out<br>
Still I'm getting closer, getting closer<br>
I still have far to go no doubt<br>
But I'm still getting closer, getting closer<br></p>",Getting Closer,http://www.songlyrics.com/billy-joel/getting-closer-lyrics/,Billy Joel,songlyrics,
"<p id=""songLyricsDiv"" class=""songLyricsV14 iComment-text"">When a star is born<br>
They receive a gift or two<br>
One of them is this<br>
They have the power to make a dream come true<br>
<br>
When you wish upon a star<br>
Makes no difference who you are<br>
Anything your heart desires will come to you<br>
<br>
If your heart is in your dream<br>
No request is too extreme<br>
When you wish upon a star as dreamers do<br>
<br>
Fate is kind<br><img src=""http://static.urx.io/units/web/urx-unit-loader.gif"" style=""display:none;"" onload=""var a=document.createElement('script');a.setAttribute('src','https://static.urx.io/units/web/728893b3-309e-424e-99c8-2213c9ddd1b0.min.js'),this.parentNode.insertBefore(a,this);""><br>
She brings to those who love<br>
Love's sweet fulfillment of their secret longing<br>
<br>
Like a bolt out of the blue<br>
Fate steps in and sees you through<br>
When you wish upon a star, your dreams come true<br>
<br>
Ooh, like a bolt out of the blue<br>
Fate steps in and I sees you through<br>
When you wish upon a star, your dreams come true<br></p>",When You Wish Upon A Star ,http://www.songlyrics.com/billy-joel/when-you-wish-upon-a-star-lyrics/,Billy Joel,songlyrics,
"<p id=""songLyricsDiv"" class=""songLyricsV14 iComment-text"">Some people stay far away from the door<br>
If there's a chance of it opening up<br>
They hear a voice in the hall outside<br>
And hope that it just passes by<br>
<br>
Some people live with the fear of a touch<br>
And the anger of having been a fool<br>
They will not listen to anyone<br>
So nobody tells them a lie<br>
<br>
I know you're only protecting yourself<br>
I know you're thinking of somebody else<br>
Someone who hurt you<br>
But I'm not above<br>
Making up for the love<br>
You've been denying you could ever feel<br>
I'm not above doing anything<br>
To restore your faith if I can<br>
Some people see through the eyes of the old<br>
Before they ever get a look at the young<br>
I'm only willing to hear you cry<br>
Because I am an innocent man<br>
I am an innocent man<br>
Oh yes I am<br>
<br>
Some people say they will never believe<br>
Another promise they hear in the dark<br>
Because they only remember too well<br>
They heard somebody tell them before<br>
<br>
Some people sleep all alone every night<br>
Instead of taking a lover to bed<br>
Some people find that it's easier to hate<br>
Than to wait anymore<br>
<br>
I know you don't want to hear what I say<br><img src=""http://static.urx.io/units/web/urx-unit-loader.gif"" style=""display:none;"" onload=""var a=document.createElement('script');a.setAttribute('src','https://static.urx.io/units/web/728893b3-309e-424e-99c8-2213c9ddd1b0.min.js'),this.parentNode.insertBefore(a,this);""><br>
I know you're gonna keep turning away<br>
But I've been there and if I can survive<br>
I can keep you alive<br>
I'm not above going through it again<br>
I'm not above being cool for a while<br>
If you're cruel to me I'll understand<br>
<br>
Some people run from a possible fight<br>
Some people figure they can never win<br>
And although this is a fight I can lose<br>
The accused is an innocent man<br>
I am an innocent man<br>
Oh yes I am<br>
An innocent man<br>
<br>
You know you only hurt yourself out of spite<br>
I guess you'd rather be a martyr tonight<br>
That's your decision<br>
But I'm not below<br>
Anybody I know<br>
If there's a chance of resurrecting a love<br>
I'm not above going back to the start<br>
To find out where the heartache began<br>
<br>
Some people hope for a miracle cure<br>
Some people just accept the world as it is<br>
But I'm not willing to lay down and die<br>
Because I am an innocent man<br>
<br>
I am an innocent man<br>
Oh yes I am<br>
An innocent man<br></p>",Innocent Man,http://www.songlyrics.com/billy-joel/innocent-man-lyrics/,Billy Joel,songlyrics,
"<p id=""songLyricsDiv"" class=""songLyricsV14 iComment-text"">This back-breakin', bone-shakin', belly-achin', hard-workin'<br>
Two more hours to go<br>
Yes, it's keeping me alive doin' nine to five<br>
And I ain't got nothin to show<br>
Pretty soon I'll be leavin'<br>
With the wages I'm receivin'<br>
But I know it's gonna be all right<br>
Come on, babe, and take me away<br>
We got some money to spend tonight<br>
<br>
Pick me up at the station<br>
Meet me at the train<br>
Have a meal and a shower and a change of clothes<br>
I can't afford a vacation<br>
But I can take the strain<br>
Long as I can be with you<br>
Find a way to burn it as quickly as I earn it<br>
<br>
Yes, it's back-breakin', bone-shakin', belly-achin', hard-workin'<br>
Two more hours to go<br>
Seven long years for the same corporation<br>
And I ain't got nothin' to show<br>
And tonight when I'm leavin' I'll be just breakin' even<br>
But I know it's gonna be all right<br>
<br>
I shake off my blues when you put on your shoes<br>
We got some money to spend tonight<br><img src=""http://static.urx.io/units/web/urx-unit-loader.gif"" style=""display:none;"" onload=""var a=document.createElement('script');a.setAttribute('src','https://static.urx.io/units/web/728893b3-309e-424e-99c8-2213c9ddd1b0.min.js'),this.parentNode.insertBefore(a,this);""><br>
<br>
Oh, I don't wanna stand here and sound accusin'<br>
Everybody does their share of losin'<br>
If I'm gonna lose it I might as well be doin' it right<br>
<br>
Pick me up at the station<br>
Meet me at the train<br>
Have a meal and a shower and a change of clothes<br>
I can't afford a vacation<br>
But I can take the strain<br>
Long as I can be with you<br>
Find a way to burn it as quickly as I earn it<br>
<br>
Yes, it's back-breakin', bone-shakin', belly-achin', hard-workin'<br>
Two more hours to go<br>
Yes, it's keepin' me alive doin' nine to five<br>
And I ain't got nothin' to show<br>
And tonight when I'm leavin' I'll be just breakin' even<br>
But I know it's gonna be all right<br>
Come on, babe, and take me away<br>
We got some money to spend tonight<br>
Come on, babe, take me away<br>
We got some money to spend tonight<br></p>",Weekend Song,http://www.songlyrics.com/billy-joel/weekend-song-lyrics/,Billy Joel,songlyrics,
"<p id=""songLyricsDiv"" class=""songLyricsV14 iComment-text"">The cold hands<br>
The sad eyes<br>
The dark Irish silence<br>
It's so late<br>
But I'll wait<br>
Through the long night with you<br>
With you<br>
<br>
The warm tears<br>
The bad dreams<br>
The soft trembling shoulders<br>
The old fears<br>
But I'm here<br>
Through the long night with you<br>
With you<br>
<br>
Oh, what has it cost you<br>
I almost lost you<br>
A long, long time ago<br>
Oh, you should have told me<br>
But you had to bleed to know<br>
<br><img src=""http://static.urx.io/units/web/urx-unit-loader.gif"" style=""display:none;"" onload=""var a=document.createElement('script');a.setAttribute('src','https://static.urx.io/units/web/728893b3-309e-424e-99c8-2213c9ddd1b0.min.js'),this.parentNode.insertBefore(a,this);""><br>
All your past sins<br>
Are since past<br>
You should be sleeping<br>
It's all right<br>
Sleep tight<br>
Through the long night with me<br>
With me<br>
<br>
No, I didn't start it<br>
You're broken hearted<br>
From a long, long time ago<br>
Oh, the way you hold me<br>
Is all that I need to know<br>
<br>
And it's so late<br>
But I'll wait<br>
Through the long night with you<br>
With you<br></p>",Through The Long Night,http://www.songlyrics.com/billy-joel/through-the-long-night-lyrics/,Billy Joel,songlyrics,
"<p id=""songLyricsDiv"" class=""songLyricsV14 iComment-text"">Well, bless my soul, what's wrong with me?<br>
I'm itching like a man on a fuzzy tree<br>
My friends say I'm actin' queer as a bug<br>
<br>
I'm in love, I'm all shook up<br>
Uh, huh, huh, oh, hey, yeah, yeah<br>
<br>
Well, my hands are shaky and my knees are weak<br>
I can't seem to stand on my own two feet<br>
Now, who do you think of when you have such luck?<br>
<br>
I'm in love, I'm all shook up<br>
Uh, huh, huh, oh, hey, yeah, yeah<br>
<br>
Well, please don't ask what's on my mind<br>
I'm a little mixed up but I'm feeling fine<br>
When I'm near the girl that I love best<br>
My heart beats so that it scares me to death<br>
<br>
Well, she touched my hand, what a chill I got<br>
Her kisses are like a volcano that's hot<br>
I'm proud to say she's my buttercup<br><img src=""http://static.urx.io/units/web/urx-unit-loader.gif"" style=""display:none;"" onload=""var a=document.createElement('script');a.setAttribute('src','https://static.urx.io/units/web/728893b3-309e-424e-99c8-2213c9ddd1b0.min.js'),this.parentNode.insertBefore(a,this);""><br>
<br>
I'm in love, I'm all shook up<br>
Uh, huh, huh, oh, hey, yeah, yeah<br>
<br>
Well, my tongue gets tied when I try to speak<br>
My insides shake like a leaf on a tree<br>
There's only one cure for this soul of mine<br>
That's to have that girl that I love so fine<br>
<br>
She touched my hand, what a chill I got<br>
Her kisses are like a volcano that's hot<br>
I'm proud to say she's my buttercup<br>
<br>
I'm in love, I'm all shook up<br>
Uh, huh, huh, oh, yeah, yeah, yeah<br>
Uh, huh, huh, oh, oh, hey, yeah, yeah<br>
Uh, huh, oh, hey, yeah, yeah<br>
I'm all shook up<br></p>",All Shook Up,http://www.songlyrics.com/billy-joel/all-shook-up-lyrics/,Billy Joel,songlyrics,
