lyrics,title,url,artist,provider,match
"<p id=""songLyricsDiv"" class=""songLyricsV14 iComment-text"">Didn'cha know what I mean<br>
When I said 'I love you Josephine'? Yeah<br>
Josephine.<br>
Nothing I say does justice to you<br>
Or lights up the day the way that you do<br>
Josephine.<br>
<br>
Like a beautifil queen<br>
You deserve a crown<br>
My Josephine. Yeah<br>
Josephine.<br>
Well<br>
I pick up the phone and give you a call<br>
You come around with your sneakers and all<br>
Josephine.<br>
<br>
Well<br>
Sit right back. Suppose I went away. Ah<br><img src=""http://static.urx.io/units/web/urx-unit-loader.gif"" style=""display:none;"" onload=""var a=document.createElement('script');a.setAttribute('src','https://static.urx.io/units/web/728893b3-309e-424e-99c8-2213c9ddd1b0.min.js'),this.parentNode.insertBefore(a,this);""><br>
Honey.<br>
Would your love turn sour and moldy green?<br>
When I take from you the light of yoodle-eh-hi-hoo<br>
Would I make you sad<br>
My Josephine?<br>
<br>
You arrived on the scene<br>
You made me glad I'm alive<br>
My Josephine. Yeah<br>
Josephine.<br>
Well<br>
Nothing I say does justice to you<br>
Lights up the day the way that you do<br>
Josephine.<br></p>",Josephine,http://www.songlyrics.com/billy-joel/josephine-lyrics/,Billy Joel,songlyrics,
"<p id=""songLyricsDiv"" class=""songLyricsV14 iComment-text"">Some love is just a lie of the heart<br>
The cold remains of what began with a passionate start<br>
And they may not want it to end<br>
But it will it's just a question of when<br>
I've lived long enough to have learned<br>
The closer you get to the fire the more you get burned<br>
But that won't happen to us<br>
Because it's always been a matter of trust<br>
<br>
I know you're an emotional girl<br>
It took a lot for you to not lose your faith in this world<br>
I can't offer you proof<br>
But you're going to face a moment of truth<br>
It's hard when you're always afraid<br>
You just recover when another belief is betrayed<br>
So break my heart of you must<br>
It's a matter of trust<br>
<br>
You can't go the distance<br>
With too much resistance<br>
I know you have doubts<br>
But for God's sake don't shut me out<br>
<br>
This time you've got nothing to lose<br>
You can take it, you can leave it<br><img src=""http://static.urx.io/units/web/urx-unit-loader.gif"" style=""display:none;"" onload=""var a=document.createElement('script');a.setAttribute('src','https://static.urx.io/units/web/728893b3-309e-424e-99c8-2213c9ddd1b0.min.js'),this.parentNode.insertBefore(a,this);""><br>
Whatever you choose<br>
I won't hold back anything<br>
And I'll walk a way a fool or a king<br>
Some love is just a lie of the mind<br>
It's make believe until its only a matter of time<br>
And some might have learned to adjust<br>
But then it never was a matter of trust<br>
<br>
I'm sure you're aware love<br>
We've both had our share of<br>
Believing too long<br>
When the whole situation was wrong<br>
<br>
Some love is just a lie of the soul<br>
A constant battle for the ultimate state of control<br>
After you've heard lie upon lie<br>
There can hardly be a question of why<br>
Some love is just a lie of the heart<br>
The cold remains of what began with a passionate start<br>
But that can't happen to us<br>
Because it's always been a matter of trust<br></p>",A Matter Of Trust,http://www.songlyrics.com/billy-joel/a-matter-of-trust-lyrics/,Billy Joel,songlyrics,
"<p id=""songLyricsDiv"" class=""songLyricsV14 iComment-text"">Uptown girl <br>
She's been living in her uptown world <br>
I bet she's never had a backstreet guy <br>
I bet her momma never told her why <br>
<br>
I'm gonna try for an uptown girl <br>
She's been living in her white bread world <br>
As long as anyone with hot blood can <br>
And now she's looking for a downtown man <br>
That's what I am <br>
<br>
And when she knows what <br>
She wants from her time <br>
And when she wakes up <br>
And makes up her mind <br>
<br>
She'll see I'm not so tough <br>
Just because <br>
I'm in love with an uptown girl <br>
You know I've seen her in her uptown world <br>
She's getting tired of her high class toys <br>
And all her presents from her uptown boys <br>
She's got a choice <br>
<br>
Uptown girl <br>
You know I can't afford to buy her pearls <br><img src=""http://static.urx.io/units/web/urx-unit-loader.gif"" style=""display:none;"" onload=""var a=document.createElement('script');a.setAttribute('src','https://static.urx.io/units/web/728893b3-309e-424e-99c8-2213c9ddd1b0.min.js'),this.parentNode.insertBefore(a,this);""><br>
But maybe someday when my ship comes in <br>
She'll understand what kind of guy I've been <br>
And then I'll win <br>
<br>
And when she's walking <br>
She's looking so fine <br>
And when she's talking <br>
She'll say that she's mine <br>
<br>
She'll say I'm not so tough <br>
Just because <br>
I'm in love <br>
With an uptown girl <br>
She's been living in her white bread world <br>
As long as anyone with hot blood can <br>
And now she's looking for a downtown man <br>
That's what I am <br>
<br>
Uptown girl <br>
She's my uptown girl <br>
You know I'm in love <br>
With an uptown girl<br></p>",Uptown Girl,http://www.songlyrics.com/billy-joel/uptown-girl-lyrics/,Billy Joel,songlyrics,
"<p id=""songLyricsDiv"" class=""songLyricsV14 iComment-text"">Well I'm on the Downeaster ""Alexa"" <br>
I am cruising through Block Island Sound<br>
I have chartered a course to the Vineyard <br>
But tonight I am Nantucket bound <br>
<br>
We took on diesel back in Montauk yesterday <br>
And left this morning from the bell in Gardner's Bay <br>
Like all the locals here I've had to sell my home <br>
Too proud to leave I worked my fingers to the bone <br>
<br>
So I could own my Downeaster ""Alexa"" <br>
And I go where the ocean is deep <br>
There are giants out there in the canyons <br>
And a good captain can't fall asleep <br>
<br>
I've got bills to pay and children who need clothes <br>
I know there's fish out there but where God only knows <br>
They say these waters aren't what they used to be <br>
But I've got people back on land who count on me <br><img src=""http://static.urx.io/units/web/urx-unit-loader.gif"" style=""display:none;"" onload=""var a=document.createElement('script');a.setAttribute('src','https://static.urx.io/units/web/728893b3-309e-424e-99c8-2213c9ddd1b0.min.js'),this.parentNode.insertBefore(a,this);""><br>
<br>
So if you see my Downeaster ""Alexa"" <br>
And if you work with the rod and the reel <br>
Tell my wife I am trolling Atlantis <br>
And I still have my hands on the wheel <br>
<br>
Now I drive my Downeaster ""Alexa"" <br>
More and more miles from shore every year <br>
Since they told me I can't sell no stripers <br>
And there's no luck in swordfishing here <br>
<br>
I was a bayman like my father was before <br>
Can't make a living as a bayman anymore <br>
There ain't much future for a man who works the sea <br>
But there ain't no island left for islanders like me<br></p>",The Downeaster Alexa,http://www.songlyrics.com/billy-joel/the-downeaster-alexa-lyrics/,Billy Joel,songlyrics,
"<p id=""songLyricsDiv"" class=""songLyricsV14 iComment-text"">Well, were living here in Allentown <br>
And theyre closing all the factories down <br>
Out in Bethlehem theyre killing time <br>
Filling out forms <br>
Standing in line <br>
<br>
Well, our fathers fought the second World War <br>
Spent their weekends on the Jersey shore <br>
Met our mothers in the USO <br>
Asked them to dance <br>
Danced with them slow <br>
<br>
And were living here in Allentown <br>
But the restlessness was handed down <br>
And its getting very hard to stay <br>
<br>
Well were waiting here in Allentown <br>
For the Pennsylvania we never found <br>
For the promises our teachers gave <br>
If we worked hard <br>
If we behaved <br>
<br>
So the graduations hang on the wall <br><img src=""http://static.urx.io/units/web/urx-unit-loader.gif"" style=""display:none;"" onload=""var a=document.createElement('script');a.setAttribute('src','https://static.urx.io/units/web/728893b3-309e-424e-99c8-2213c9ddd1b0.min.js'),this.parentNode.insertBefore(a,this);""><br>
But they never really helped us at all <br>
No they never taught us what was real <br>
Iron and coke(not coal) <br>
Chromium Steel <br>
<br>
And were waiting here in Allentown <br>
But theyve taken all the coal from the ground <br>
And the union people crawled away <br>
<br>
Every child had a pretty good shot <br>
To get at least as far as their old man got <br>
But something happened on the way to that place <br>
They threw an American flag in our face <br>
<br>
Well, Im living here in Allentown <br>
And its hard to keep a good man down <br>
But I wont be getting up today <br>
<br>
And its getting very hard to stay <br>
And were living here in Allentown<br></p>",Allentown,http://www.songlyrics.com/billy-joel/allentown-lyrics/,Billy Joel,songlyrics,
"<p id=""songLyricsDiv"" class=""songLyricsV14 iComment-text"">Billy Joel<br>
Miscellaneous<br>
For The Longest Time<br>
Oh, Oh, Oh <br>
For the longest time <br>
Oh, Oh, Oh <br>
For the longest time <br>
<br>
If you said goodbye to me tonight <br>
There would still be music left to write <br>
What else could I do, I'm so inspired by you <br>
That hasn't happened for the longest time <br>
<br>
Once I thought my innocence was gone <br>
Now I know that happiness goes on <br>
That's when you found me, when you put your arms around me <br>
I haven't been there for the longest time <br>
<br>
Oh, Oh, Oh <br>
For the longest time <br>
Oh, Oh, Oh <br>
For the longest time <br>
<br>
I'm that voice you're hearing in the hall <br>
And the greatest miracle of all <br>
Is how I need you, and how you needed me too <br><img src=""http://static.urx.io/units/web/urx-unit-loader.gif"" style=""display:none;"" onload=""var a=document.createElement('script');a.setAttribute('src','https://static.urx.io/units/web/728893b3-309e-424e-99c8-2213c9ddd1b0.min.js'),this.parentNode.insertBefore(a,this);""><br>
That hasn't happened in the longest time <br>
<br>
Maybe this won't last very long <br>
But you feel so right <br>
And I could be wrong <br>
Maybe I've gone this far <br>
And it's more than I'd hoped for <br>
<br>
Who knows how much further we'll go on <br>
Maybe I'll be sorry when you're gone <br>
I'll take my chances, I forgot how nice romance is <br>
I haven't been there for the longest time <br>
<br>
I had second thoughts at the start <br>
I said to myself, hold on to your heart <br>
Now I know the woman that you are <br>
It's wonderful so far <br>
And you're more than I'd hoped for <br>
<br>
I don't care what consequence it brings <br>
I have been a fool for lesser things <br>
I want you so bad, I think you ought to know that <br>
I intend to hold you for the longest time<br></p>",For The Longest Time,http://www.songlyrics.com/billy-joel/for-the-longest-time-lyrics/,Billy Joel,songlyrics,
"<p id=""songLyricsDiv"" class=""songLyricsV14 iComment-text"">Little Geo is a friend of mine<br>
We get some money and we buy a cheap wine<br>
Sit on the corner and have a holiday<br>
<br>
Hide the bottle when the cop goes by<br>
Talk about women and lie, lie, lie<br>
Oh, my other world is just a half a mile away<br>
<br>
Wait for mama to turn out the light<br>
Crawl on the roof and then I hit the night<br>
I should be sleeping but tonight I just can't stay<br>
<br>
I've given everybody so much time<br>
Now I need a moment that's mine<br>
Oh my other world is just a half a mile away<br>
<br>
It's just a half a mile away<br>
It's just a half a mile away<br>
It's just a half a mile away<br>
<br>
Angelina, save a place for me<br>
I've been livin' someone else's life and now I've got to be free<br>
Turn your transistor on and let the music play<br>
<br><img src=""http://static.urx.io/units/web/urx-unit-loader.gif"" style=""display:none;"" onload=""var a=document.createElement('script');a.setAttribute('src','https://static.urx.io/units/web/728893b3-309e-424e-99c8-2213c9ddd1b0.min.js'),this.parentNode.insertBefore(a,this);""><br>
I try to keep the family satisfied<br>
But there's gotta be more to life than just try, try, try<br>
Oh my other world is only half a mile away<br>
<br>
It's just a half a mile away<br>
It's just a half a mile away<br>
It's just a half a mile away<br>
<br>
I've given everybody so much time<br>
Now I need a moment that's mine<br>
Oh my other world is just a half a mile away<br>
<br>
Don't you know it's just a half a mile away<br>
Just, just, just, just, just half a mile away<br>
Don't you understand it's just half a mile away<br>
<br>
Just, just, just, just, just, just, just, just<br>
Just, just a half a mile away<br>
Everyone got to know it's just a half a mile away<br>
Yeah, just half a mile away<br></p>",Half a Mile Away,http://www.songlyrics.com/billy-joel/half-a-mile-away-lyrics/,Billy Joel,songlyrics,
"<p id=""songLyricsDiv"" class=""songLyricsV14 iComment-text"">It's nine o'clock on a Saturday <br>
the regular crowd shuffles in <br>
There's an old man sitting next to me <br>
Makin' love to his tonic and gin <br>
Son can you play me a memory<br>
Not really sure how it goes<br>
But it's sad and it's sweet and I knew it complete <br>
When I wore a younger man's clothes <br>
Da da da de de da <br>
da da de de da da da <br>
Sing us a song, you're the piano man <br>
sing us a song tonight <br>
Well, we're all in the mood for a melody <br>
And you've got us feelin' alright <br>
Now John at the bar is a friend of mine <br>
He gets me my drinks for free <br>
And he's quick with a joke or to light up your smoke <br>
But there's someplace that he'd rather be <br>
He says Bill, I believe this is killing me <br>
As the smile ran away from his face <br>
Well I'm sure that I could be a movie star <br>
If I could get out of this place <br>
Sing us a song, you're the piano man <br>
sing us a song tonight <br>
Well, we're all in the mood for a melody <br>
And you've got us feelin' alright <br><img src=""http://static.urx.io/units/web/urx-unit-loader.gif"" style=""display:none;"" onload=""var a=document.createElement('script');a.setAttribute('src','https://static.urx.io/units/web/728893b3-309e-424e-99c8-2213c9ddd1b0.min.js'),this.parentNode.insertBefore(a,this);""><br>
Now Paul is a real estate novelist <br>
Who never had time for a wife <br>
And he's talking with Davy who's still in the navy <br>
And probably will be for life <br>
And the waitress is practicing politics <br>
As the businessmen slowly get stoned <br>
Yes, they're sharing a drink they call loneliness <br>
But it's better than drinking alone <br>
It's a pretty good crowd for a Saturday, <br>
And the manager gives me a smile <br>
'Cause he knows that it's me they've been coming to see <br>
To forget about life for awhile. <br>
And the piano sounds like a carnival <br>
And the microphone smells like a beer <br>
And they sit at the bar and put bread in my jar <br>
And say ""Man, what are you doin' here?"" <br>
Da da da de de da <br>
da da de de da da da <br>
Sing us a song, you're the piano man <br>
Sing us a song tonight. <br>
Well, we're all in the mood for a melody <br>
And you've got us feelin' alright.<br></p>",Piano Man,http://www.songlyrics.com/billy-joel/piano-man-lyrics/,Billy Joel,songlyrics,
"<p id=""songLyricsDiv"" class=""songLyricsV14 iComment-text"">Billy Joel<br>
Miscellaneous<br>
Light As A Breeze<br>
She stands before you naked<br>
You can see it, you can taste it<br>
But she comes to you<br>
Light as the breeze<br>
You can drink or you can nurse it<br>
It don't matter how you worship<br>
As long as you're<br>
Down on your knees<br>
<br>
So I knelt there at the delta<br>
At the alpha and the omega<br>
At the cradle of the river<br>
And the seas<br>
And like a blessing come from heaven,<br>
For something like a second,<br>
I was healed, and my heart<br>
Was at ease<br>
<br>
O baby I waited<br>
So long for your kiss<br>
For something to happen<br>
Oh-something like this<br>
<br>
And you're weak and you're harmless<br>
And you're sleeping in your harness<br>
And the wind going wild<br>
In the trees<br>
And it's not exactly prison<br>
But you'll never be forgiven<br>
For whatever you've done<br>
With the keys<br>
<br>
O baby I waited<br>
So long for your kiss<br>
For something to happen<br>
Oh-something like this<br>
<br>
It's dark and it's snowing<br>
Oh my love I must be going<br>
The river is starting to freeze<br><img src=""http://static.urx.io/units/web/urx-unit-loader.gif"" style=""display:none;"" onload=""var a=document.createElement('script');a.setAttribute('src','https://static.urx.io/units/web/728893b3-309e-424e-99c8-2213c9ddd1b0.min.js'),this.parentNode.insertBefore(a,this);""><br>
And I'm sick of pretending<br>
I'm broken from bending<br>
I've lived too long<br>
On my knees<br>
And she dances so graceful<br>
And your heart's hard and hateful<br>
And she's naked<br>
But that's just a tease<br>
And you turn in disgust<br>
From your hatred and from your love<br>
And she comes to you<br>
Light as the breeze<br>
<br>
O baby I waited<br>
So long for your kiss<br>
For something to happen<br>
Oh-something like this<br>
<br>
There's blood on every bracelet<br>
You can see it, you can taste it<br>
And it's please baby<br>
Please baby please<br>
And she says, drink deeply, pilgrim<br>
But don't forget there's still a woman<br>
Beneath this<br>
Resplendent chemise<br>
<br>
So I knelt there at the delta<br>
At the alpha and the omega<br>
I knelt there<br>
Like one who believes<br>
And like a blessing come from heaven<br>
For something like a second<br>
I was cured, and my heart<br>
Was at ease<br>
<br>
O baby I waited<br>
So long for your kiss<br>
For something to happen<br>
Oh-something like this<br></p>",Light As A Breeze,http://www.songlyrics.com/billy-joel/light-as-a-breeze-lyrics/,Billy Joel,songlyrics,
"<p id=""songLyricsDiv"" class=""songLyricsV14 iComment-text"">Viktor was born in the spring of '44<br>
And never saw his father anymore<br>
A child of sacrifice, a child of war<br>
Another son who never had a father after Leningrad<br>
<br>
Went off to school and learned to serve the state<br>
Followed the rules and drank his vodka straight<br>
The only way to live was drown the hate<br>
A Russian life was very sad and such was life in Leningrad<br>
<br>
I was born in '49<br>
A cold war kid in McCarthy time<br>
Stop 'em at the 38th Parallel<br>
Blast those yellow reds to hell<br>
<br>
And cold war kids were hard to kill<br>
Under their desk in an air raid drill<br>
Haven't they heard we won the war<br>
What do they keep on fighting for?<br>
<br>
Viktor was sent to some Red Army town<br><img src=""http://static.urx.io/units/web/urx-unit-loader.gif"" style=""display:none;"" onload=""var a=document.createElement('script');a.setAttribute('src','https://static.urx.io/units/web/728893b3-309e-424e-99c8-2213c9ddd1b0.min.js'),this.parentNode.insertBefore(a,this);""><br>
Served out his time, became a circus clown<br>
The greatest happiness he'd ever found<br>
Was making Russian children glad and children lived in Leningrad<br>
<br>
But children lived in Levittown<br>
And hid in the shelters underground<br>
Until the Soviets turned their ships around<br>
Tore the Cuban missiles down<br>
<br>
And in that bright October sun<br>
We knew our childhood days were done<br>
And I watched my friends go off to war<br>
What do they keep on fighting for?<br>
<br>
So my child and I came to this place<br>
To meet him eye to eye and face to face<br>
He made my daughter laugh, then we embraced<br>
We never knew what friends we had until we came to Leningrad<br></p>",Leningrad,http://www.songlyrics.com/billy-joel/leningrad-lyrics/,Billy Joel,songlyrics,
"<p id=""songLyricsDiv"" class=""songLyricsV14 iComment-text"">She can kill with a smile<br>
She can wound with her eyes<br>
She can ruin your faith with her casual lies<br>
And she only reveals what she wants you to see<br>
She hides like a child<br>
But she's always a woman to me<br>
<br>
She can lead you to love<br>
She can take you or leave you<br>
She can ask for the truth<br>
But she'll never believe<br>
And she'll take what you give her as long as it's free<br>
Yeah, she steals like a thief<br>
But she's always a woman to me<br>
<br>
[Chorus:]<br>
Oh, she takes care of herself<br>
She can wait if she wants<br>
She's ahead of her time<br>
Oh, and she never gives out<br>
And she never gives in<br>
She just changes her mind<br>
<br>
She will promise you more<br>
Than the Garden of Eden<br>
Then she'll carelessly cut you<br><img src=""http://static.urx.io/units/web/urx-unit-loader.gif"" style=""display:none;"" onload=""var a=document.createElement('script');a.setAttribute('src','https://static.urx.io/units/web/728893b3-309e-424e-99c8-2213c9ddd1b0.min.js'),this.parentNode.insertBefore(a,this);""><br>
And laugh while you're bleedin'<br>
But she'll bring out the best<br>
And the worst you can be<br>
Blame it all on yourself<br>
Cause she's always a woman to me<br>
<br>
[Chorus:]<br>
Oh, she takes care of herself<br>
She can wait if she wants<br>
She's ahead of her time<br>
Oh, and she never gives out<br>
And she never gives in<br>
She just changes her mind<br>
<br>
She is frequently kind<br>
And she's suddenly cruel<br>
She can do as she pleases<br>
She's nobody's fool<br>
But she can't be convicted<br>
She's earned her degree<br>
And the most she will do<br>
Is throw shadows at you<br>
But she's always a woman to me<br></p>",Shes Always A Woman,http://www.songlyrics.com/billy-joel/shes-always-a-woman-lyrics/,Billy Joel,songlyrics,
"<p id=""songLyricsDiv"" class=""songLyricsV14 iComment-text"">Call me a joker, call me a fool <br>
Right at this moment I'm totally cool <br>
Clear as a crystal, sharp as a knife <br>
I feel like I'm in the prime of my life <br>
Sometimes it feels like I'm going too fast <br>
I don't know how long this feeling will last <br>
Maybe it's only tonight <br>
<br>
Darling I don't know why I got to extremes <br>
Too high or too low there ain't no in-betweens <br>
And if I stand or I fall <br>
It's all or nothing at all <br>
Darling I don't know why I got to extremes <br>
<br>
Sometimes I'm tired, sometimes I'm shot <br>
Sometimes I don't know how much more I've got <br>
Maybe I'm headed over the hill <br>
Maybe I've set myself up for the kill <br>
Tell me how much do you think you can take <br>
Until the heart in you is starting to break? <br>
Sometimes it feels like it will <br>
<br>
Darling I don't know why I go to extremes <br>
Too high or too low there ain't no in-betweens <br>
You can be sure when I'm gone <br>
I won't be out there too long <br>
Darling I don't know why I got to extremes <br><img src=""http://static.urx.io/units/web/urx-unit-loader.gif"" style=""display:none;"" onload=""var a=document.createElement('script');a.setAttribute('src','https://static.urx.io/units/web/728893b3-309e-424e-99c8-2213c9ddd1b0.min.js'),this.parentNode.insertBefore(a,this);""><br>
<br>
Out of the darkness, into the light <br>
Leaving the scene of the crime <br>
Either I'm wrong or I'm perfectly right every time <br>
Sometimes I lie awake, night after night <br>
Coming apart at the seams <br>
Eager to please, ready to fight <br>
Why do I go to extremes? <br>
<br>
And if I stand or I fall <br>
It's all or nothing at all <br>
<br>
Darling I don't know why I go to extremes <br>
Too high or too low there ain't no in-betweens <br>
And if I stand of I fall <br>
It's all or nothing at all <br>
Darling I don't know why I go to extremes <br>
<br>
No I don't know why I go to extremes <br>
Too high or too low there ain't no in-betweens <br>
You can be sure when I'm gone <br>
I won't be out there too long <br>
Darling I don't know why I go to extremes<br></p>",I Go To Extremes,http://www.songlyrics.com/billy-joel/i-go-to-extremes-lyrics/,Billy Joel,songlyrics,
"<p id=""songLyricsDiv"" class=""songLyricsV14 iComment-text"">(Instrumental)<br></p>",Elegy For The Fisherman ,http://www.songlyrics.com/billy-joel/elegy-for-the-fisherman-lyrics/,Billy Joel,songlyrics,
