lyrics,title,url,artist,provider,match
"<p id=""songLyricsDiv"" class=""songLyricsV14 iComment-text"">She cuts you once, she cuts you twice<br>
But still you believe<br>
The wound is so fresh you can taste the blood<br>
BUt you don't have strength to leave<br>
You've been bought, you've been sold<br>
You've been locked outside the door<br>
But you stand there pleadin',<br>
With your insides bleedin',<br>
'Cause you deep down want some more<br>
Then she says she wants forgiveness<br>
It's such a clever masquerade<br>
She's so good with her stiletto<br>
You don't even see the blade<br>
<br>
She cuts you hard, she cuts you deep,<br>
She's got so much skill<br>
She's so fascinating that you're still there waiting<br>
When she comes back for the kill<br>
You've been slashed in the face<br>
You've been left there to bleed<br>
You want to run away<br>
But you know you're gonna stay<br>
'Cause she gives you what you need<br><img src=""http://static.urx.io/units/web/urx-unit-loader.gif"" style=""display:none;"" onload=""var a=document.createElement('script');a.setAttribute('src','https://static.urx.io/units/web/728893b3-309e-424e-99c8-2213c9ddd1b0.min.js'),this.parentNode.insertBefore(a,this);""><br>
Then she says she wants affection<br>
While she searches for the vein<br>
She's so good with her stiletto<br>
You don't really mind the pain<br>
<br>
She cuts you out, she cuts you down<br>
She carves up your life<br>
But you won't do nothng<br>
As she keeps on cutting<br>
'Cause you know you love the knife<br>
You've been bought, you've been sold<br>
You've been locked outside the door<br>
But you stand there pleadin'<br>
With your insides bleedin'<br>
'Cause you deep down want some more<br>
Then she says she needs affection<br>
While she searches for the vein<br>
She's so good with her stiletto,<br>
You don't really mind the pain<br></p>",Stiletto,http://www.songlyrics.com/billy-joel/stiletto-lyrics/,Billy Joel,songlyrics,
"<p id=""songLyricsDiv"" class=""songLyricsV14 iComment-text"">There you go, slipping away into a state of grace<br>
I know the look that comes across your face<br>
It's so familiar to me<br>
Here I am, trying to keep you in my line of sight<br>
I'm never certain that you read me right<br>
Sometimes you don't want to see me<br>
<br>
Here we are, both of us know we're in love<br>
But that isn't always enough<br>
I never could rise above it all, down I fall<br>
<br>
But darling there you go, slipping away into a state of grace<br>
Granted, this world is not a perfect place<br>
Still it's the world that I'm in<br>
Here I am talking while you don't hear a word I say<br>
Knowing you're waatching me from far away<br>
Somewhere that I've never been<br>
<br>
Don't you see, you lived a different life than me<br><img src=""http://static.urx.io/units/web/urx-unit-loader.gif"" style=""display:none;"" onload=""var a=document.createElement('script');a.setAttribute('src','https://static.urx.io/units/web/728893b3-309e-424e-99c8-2213c9ddd1b0.min.js'),this.parentNode.insertBefore(a,this);""><br>
It doesn't mean you have to be afraid of how<br>
We're not the same, don't leave me now<br>
<br>
But darling there you go, slipping away<br>
<br>
How can I get you to stay where you are<br>
Keep you from going to far<br>
Holding you here is so hard to do...I'm losing you<br>
<br>
And darling there you go, slipping away into a state of grace<br>
Drifting away into your sacred place<br>
Someplace that I've never been<br>
There you go, slipping away, slipping away into a state of grace<br>
There you go, slipping away into a state of grace<br>
There you go...drifting away...<br></p>",State Of Grace,http://www.songlyrics.com/billy-joel/state-of-grace-lyrics/,Billy Joel,songlyrics,
"<p id=""songLyricsDiv"" class=""songLyricsV14 iComment-text"">Come gather 'round people wherever you roam<br>
And admit that the waters around you have grown<br>
And accept that soon you'll be drenched to the bone<br>
<br>
If your time to you is worth savin'<br>
Then you better start swimmin' or you'll sink like a stone<br>
For the times, they are a-changin'<br>
<br>
Come writers and critics who prophesize with your pen<br>
And keep your eyes wide, the chance won't come again<br>
And don't speak too soon for the wheel's still in spin<br>
<br>
And there's no tellin' now where it's namin'<br>
For the loser now will be later to win<br>
For the times, they are a-changin'<br>
<br>
Come mothers and fathers throughout the land<br><img src=""http://static.urx.io/units/web/urx-unit-loader.gif"" style=""display:none;"" onload=""var a=document.createElement('script');a.setAttribute('src','https://static.urx.io/units/web/728893b3-309e-424e-99c8-2213c9ddd1b0.min.js'),this.parentNode.insertBefore(a,this);""><br>
And don't criticize what you don't understand<br>
Your sons and your daughters are beyond your command<br>
<br>
Your old road is rapidly agin'<br>
So get out of the new one if you can't lend your hand<br>
For the times, they are a-changin'<br>
<br>
The line, it is drawn, the curse, it is cast<br>
Slow one now will later be last<br>
As the present now will later be past<br>
<br>
The order is rapidly fadin'<br>
And the first one now will later be last<br>
For the times, they are a-changin'<br></p>",The Times They Are A-Changin' (Live),http://www.songlyrics.com/billy-joel/the-times-they-are-a-changin-live-lyrics/,Billy Joel,songlyrics,
"<p id=""songLyricsDiv"" class=""songLyricsV14 iComment-text"">Billy Joel<br>
Miscellaneous<br>
Just For<br>
Just For<br>
<br>
i want to take his eyes out <br>
just for touching you<br>
yes i do<br>
and i want to take his hands off<br>
just for touching you<br>
yes i do<br>
<br>
(chorus)<br>
ooooooooo and i want to rip his or heart out<br>
just for hurting you<br>
and i want to break his mind down<br><img src=""http://static.urx.io/units/web/urx-unit-loader.gif"" style=""display:none;"" onload=""var a=document.createElement('script');a.setAttribute('src','https://static.urx.io/units/web/728893b3-309e-424e-99c8-2213c9ddd1b0.min.js'),this.parentNode.insertBefore(a,this);""><br>
yes i do, yes i do,yes i dooooooo<br>
<br>
and i want to regret life since he met you<br>
yes i do<br>
and i want to take back <br>
all that he took from you<br>
yes i do<br>
<br>
chorus tmes x 2<br>
<br>
subbmmitted by yann<br>
<br>
From yann (yanniscool@email.com)<br></p>",Just For,http://www.songlyrics.com/billy-joel/just-for-lyrics/,Billy Joel,songlyrics,
"<p id=""songLyricsDiv"" class=""songLyricsV14 iComment-text"">Well I'm shameless when it comes to loving you<br>
I'd do anything you want me to<br>
I'd do anything at all<br>
<br>
And I'm standing here for all the world to see<br>
There ain't that much left of me<br>
That has very far to fall<br>
<br>
You know I'm not a man who has ever been<br>
Insecure about the world I've been living in<br>
I don't break easy, I have my pride<br>
But if you need to be satisfied<br>
<br>
I'm shameless, baby I don't have a prayer<br>
Anytime I see you standing there<br>
I go down upon my knees<br>
<br>
And I'm changing, I swore I'd never compromise<br>
But you convinced  me otherwise<br>
I'll do anything you please<br>
<br>
You see in all my life I've never found<br>
What I couldn't resist, what I couldn't turn down<br>
I could walk away fromnyone I ever knew<br>
But I can't walk away from you<br><img src=""http://static.urx.io/units/web/urx-unit-loader.gif"" style=""display:none;"" onload=""var a=document.createElement('script');a.setAttribute('src','https://static.urx.io/units/web/728893b3-309e-424e-99c8-2213c9ddd1b0.min.js'),this.parentNode.insertBefore(a,this);""><br>
<br>
I have never let anything have this much control over me<br>
Cause I worked too hard to call my life my own<br>
Yes I made myeself a world and it worked so perfectly<br>
But it's your world now, I can't refuse<br>
I never had so much to lose<br>
I'm shameless...shameless<br>
<br>
You know it should be easy for a man who's strong<br>
To say he's sorry or admit when he's wrong<br>
I've never lost anything I ever missed<br>
But I've never been in love like this...<br>
<br>
It's out of my hands<br>
<br>
I'm shameless, shameless as a man can be<br>
You can make a total fool of me<br>
I just wanted you to know<br>
<br>
I am shameless<br>
Shameless<br>
Shameless...<br></p>",Shameless,http://www.songlyrics.com/billy-joel/shameless-lyrics/,Billy Joel,songlyrics,
"<p id=""songLyricsDiv"" class=""songLyricsV14 iComment-text"">Now wait a minute, I can remember back around 1962<br>
Me and my hoodlum friends used to come here to the Bronx<br>
To get some of them White Castle hamburgers<br>
Yeah, and, and as for them, I, I can still taste them<br>
From back in 1962, now wait a minute<br>
<br>
You know you make me wanna shout<br>
Throw my arms up and shout, and kick my heels up and shout<br>
Throw my hands up back and shout, come on now, shout<br>
Come on now, shout, come on now, shout, come on now, shout<br>
<br>
You know you make me wanna shout<br>
Throw my arms up and shout, and kick my heels up and shout<br>
And throw my arms up and shout, come on now, shout<br>
Come on now, shout, come on now, shout, come on now, shout<br>
<br>
Do you remember when you used to be nine years old?<br>
Yeah, and I still remember, from the bottom of my soul<br>
And now that you remember, you're old enough to know<br>
You won't believe me, hey, you want to let me go<br>
<br>
I want you to know, I want you to know right now<br><img src=""http://static.urx.io/units/web/urx-unit-loader.gif"" style=""display:none;"" onload=""var a=document.createElement('script');a.setAttribute('src','https://static.urx.io/units/web/728893b3-309e-424e-99c8-2213c9ddd1b0.min.js'),this.parentNode.insertBefore(a,this);""><br>
If you ever leave me, I don't want nobody else<br>
If you ever leave me, I refuse to let you go<br>
I want you to know, I want you to know<br>
<br>
You know you make me wanna shout<br>
Throw my arms up and shout and kick my heels back and shout<br>
Now throw my hands up and shout<br>
I gotta get back and shout, come on now, shout<br>
<br>
Come on now, shout, come on now, shout, come on now, shout<br>
Come on now, shout, come on now, shout, come on now, shout<br>
<br>
Let me hear you say shout, shout, shout<br>
A li'l bit softer now, a li'l bit softer now<br>
A li'l bit softer now, a li'l bit softer now<br>
<br>
Just a li'l bit softer now, just a li'l bit softer now, just a li'l bit softer now<br>
Just a li'l bit softer now, just a li'l bit softer now, just a li'l bit softer now<br>
Just a li'l bit softer now, just a li'l bit softer now<br></p>",Shout (Live),http://www.songlyrics.com/billy-joel/shout-live-lyrics/,Billy Joel,songlyrics,
"<p id=""songLyricsDiv"" class=""songLyricsV14 iComment-text"">Billy Joel<br>
Miscellaneous<br>
Tomorrow is Today<br>
I've been livin' for the moment <br>
But I just can't have my way <br>
And I'm afraid to go to sleep <br>
'Cause tomorrow is today <br>
 <br>
People tell me life is sweeter <br>
But I don't hear what they say <br>
Nothing comes to change my life <br>
So tomorrow is today <br>
 <br>
I don't care to know the hour <br>
'Cause it's passing anyway <br>
I don't have to see tomorrow <br>
'Cause I saw it yesterday <br>
 <br>
So I listen for and answer <br>
But the feeling seems to stay <br>
And what's the use of always dreaming <br>
If tomorrow is today  <br>
 <br>
Still I'm waiting for the morning <br>
But it feels so far away <br>
And you don't need the love I'm giving <br><img src=""http://static.urx.io/units/web/urx-unit-loader.gif"" style=""display:none;"" onload=""var a=document.createElement('script');a.setAttribute('src','https://static.urx.io/units/web/728893b3-309e-424e-99c8-2213c9ddd1b0.min.js'),this.parentNode.insertBefore(a,this);""><br>
So tomorrow is today <br>
 <br>
Oh, my.  Goin' to the river<br>
Gonna take a ride and the Lord will deliver me <br>
Made my bed, now I'm gonna lie in it <br>
If you don't come, I'm sure gonna die in it <br>
Too late.  Too much given <br>
I've seen a lot of life and I'm damn sick of livin' it <br>
I keep hopin' that you will pass my way <br>
 <br>
And some day if your dreams are leavin' you <br>
I'll still believe in you <br>
<br>
I don't care to know the hour  <br>
'Cause it's passing anyway <br>
I don't have to see tomorrow <br>
'Cause I saw it yesterday      <br>
 <br>
Though I'm living and I'm singing <br>
And although my hands still play <br>
Soon enough it will all be over <br>
'Cause tomorrow is today<br></p>",Tomorrow is Today,http://www.songlyrics.com/billy-joel/tomorrow-is-today-lyrics/,Billy Joel,songlyrics,
"<p id=""songLyricsDiv"" class=""songLyricsV14 iComment-text"">All the waiters in you grand cafe <br>
Leave their tables when you blink <br>
Every dog must have his everyday <br>
Every drunk must have his drink <br>
Don't wait for answers <br>
Just take your chances <br>
Don't ask me why <br>
<br>
All your life you had to stand in line <br>
Still you're standing on your feet <br>
All your choices made you change your mind <br>
Now your calendar's complete <br>
Don't wait for answers <br>
Just take your chances <br>
Don't ask me why <br>
<br>
You can say the human heart is only make believe <br>
And I am only fighting fire with fire <br>
But you are still a victim <br>
of the accidents you leave <br>
As sure as I'm a victim of desire <br><img src=""http://static.urx.io/units/web/urx-unit-loader.gif"" style=""display:none;"" onload=""var a=document.createElement('script');a.setAttribute('src','https://static.urx.io/units/web/728893b3-309e-424e-99c8-2213c9ddd1b0.min.js'),this.parentNode.insertBefore(a,this);""><br>
<br>
All the servants in your new hotel <br>
Throw their roses at your feet <br>
Fool them all but baby I can tell <br>
You're no stranger to the street <br>
Don't ask for favors <br>
Don't talk to strangers <br>
Don't ask me why <br>
<br>
Yesterday you were an only child <br>
Now your ghosts have gone away <br>
You can kill them in the classic style <br>
Now you, ""parlez vous francais"" <br>
Don't look for answers <br>
You took your chances <br>
Don't ask me why <br>
Don't ask me why<br></p>",Don't Ask Me Why,http://www.songlyrics.com/billy-joel/don-t-ask-me-why-lyrics/,Billy Joel,songlyrics,
"<p id=""songLyricsDiv"" class=""songLyricsV14 iComment-text"">A picture postcard<br>
A folded stub<br>
A program of the play<br>
File away your photographs<br>
Of your holiday<br>
<br>
And your mementos<br>
Will turn to dust<br><img src=""http://static.urx.io/units/web/urx-unit-loader.gif"" style=""display:none;"" onload=""var a=document.createElement('script');a.setAttribute('src','https://static.urx.io/units/web/728893b3-309e-424e-99c8-2213c9ddd1b0.min.js'),this.parentNode.insertBefore(a,this);""><br>
But that's the price you pay<br>
For every year's a souvenir<br>
That slowly fades away<br>
Every year's a souvenir<br>
That slowly fades away<br></p>",Souvenir,http://www.songlyrics.com/billy-joel/souvenir-lyrics/,Billy Joel,songlyrics,
"<p id=""songLyricsDiv"" class=""songLyricsV14 iComment-text"">Oo Hoo, oh oh... <br>
<br>
Anthony works in the grocery store <br>
Saving his pennies for someday. <br>
Momma Leoni left a note on the door. <br>
She said, ""Sonny, move out to the country. <br>
Aw, but working too hard can give you a heart attack, ack, ack, ack, ack, ack; <br>
You oughtta know by now. <br>
Who need a house out in Hackensack? <br>
Is that all you get for your money? <br>
And it seems such a waste of time. <br>
If that's what it's all about... <br>
Momma, if that's moving up, than I'm moving out. <br>
<br>
Mmm I'm movin out <br>
mm hmm, Oo Hoo... <br>
<br>
Seargeant O'Leary is walking the beat. <br>
At night he becomes a bartender. <br>
He works at Mr. Cacciatorre's down on Sullivant Street, <br>
Across from the medical center, <br>
And he's trading in his Chevy for a Cadillac, lac, lac, lac lac,lac; <br>
You oughtta know by now, <br><img src=""http://static.urx.io/units/web/urx-unit-loader.gif"" style=""display:none;"" onload=""var a=document.createElement('script');a.setAttribute('src','https://static.urx.io/units/web/728893b3-309e-424e-99c8-2213c9ddd1b0.min.js'),this.parentNode.insertBefore(a,this);""><br>
If he can't drive with a broken back, <br>
At least he can polish the fenders. <br>
And it seems such a waste of time, <br>
If that's what it's all about... <br>
Momma, if that's moving up, than I'm moving out. <br>
<br>
Oo I'm movin out, Oh oh, Oo hoo... <br>
<br>
You should never argue with a crazy, ma, ma, ma, ma man; <br>
You oughtta know by now. <br>
You can pay Uncle Sam with the overtime <br>
Is that all you get for your money? <br>
And if thats what you have in mind <br>
yeah if thats what you're all about.. <br>
Good luck moving up, cause I'm moving out. <br>
<br>
Oo I'm movin out <br>
mmhmm Oo hoo uh-huh mmhmm... <br>
<br>
I'm movin' out!<br></p>",Movin Out,http://www.songlyrics.com/billy-joel/movin-out-lyrics/,Billy Joel,songlyrics,
"<p id=""songLyricsDiv"" class=""songLyricsV14 iComment-text"">Late at night <br>
When it's dark and cold <br>
I reach out <br>
For someone to hold <br>
When I'm blue <br>
When I'm lonely <br>
She comes through <br>
She's the only one who can <br>
My baby grand <br>
Is all I need <br>
<br>
In my time <br>
I've wandered everywhere <br>
Around this world <br>
She would always be there <br>
Any day <br>
Any hour <br>
All it takes <br>
Is the power in my hands <br>
This baby grand's <br>
Been good to me <br>
<br>
I've had friends <br>
But they have slipped away <br>
I've had fame <br>
But it doesn't stay <br>
I've made fortunes <br>
Spent them fast enough <br><img src=""http://static.urx.io/units/web/urx-unit-loader.gif"" style=""display:none;"" onload=""var a=document.createElement('script');a.setAttribute('src','https://static.urx.io/units/web/728893b3-309e-424e-99c8-2213c9ddd1b0.min.js'),this.parentNode.insertBefore(a,this);""><br>
As for woman <br>
They don't last with just one man <br>
But baby grand <br>
Will stand by me <br>
<br>
They say that no one's gonna play this on the radio <br>
They said the melancholy blues were dead and gone <br>
But only songs like these <br>
Played in minor keys <br>
Keep those memories holding on <br>
<br>
I've come far <br>
From the life I've strayed in <br>
I've got scars <br>
From those dives I've played in <br>
Now I'm home <br>
And I'm weary <br>
In my bones <br>
Every dreary one night stand <br>
But baby grand <br>
Came home with me <br>
<br>
Ever since this gig began <br>
My baby grand's <br>
Been good to me<br></p>",Baby Grand,http://www.songlyrics.com/billy-joel/baby-grand-lyrics/,Billy Joel,songlyrics,
"<p id=""songLyricsDiv"" class=""songLyricsV14 iComment-text"">Blackout, heatwave, .44 caliber homicide<br>
The buns drop dead and dogs go mad<br>
In packs on the West Side<br>
Young girl standing on a ledge looks like another suicide<br>
She wants to hit those bricks<br>
'Cause the news at six gotta stick to a deadline<br>
While the millionaires hide in Beekman Place<br>
The bag ladies throw their bones in my face<br>
I get attacked by a kid with stereo sound<br>
I don't want to hear it but he won't turn it down<br>
Life is tough but it's just enough<br>
To hold back the tears until it's closing time<br>
I survived, I'm still alive<br>
But I'm getting close to the borderline<br>
Close to the borderline<br>
<br>
A buck three eighty<br>
Won't buy you much lately on the street these days<br>
And when you can get gas<br>
You know you can't drive fast anymore on the parkways<br>
Rich man, poor man, either way American<br>
Shoved into the lost and found<br>
The no nuke yell we're gonna all go to hell<br>
With the next big meltdown<br>
I got remote control and a color T.V.<br>
I don't change channels so they must change me<br><img src=""http://static.urx.io/units/web/urx-unit-loader.gif"" style=""display:none;"" onload=""var a=document.createElement('script');a.setAttribute('src','https://static.urx.io/units/web/728893b3-309e-424e-99c8-2213c9ddd1b0.min.js'),this.parentNode.insertBefore(a,this);""><br>
I got real close friends that will get me high<br>
THey don't know hot to talk and they ain't gonna try<br>
I shouldn't bitch, I shouldn't cry<br>
I'd start a revolution but I don't have time<br>
I don't know why I'm still a nice guy<br>
But I'm getting close to the borderline<br>
Close to the borderline<br>
<br>
I thought I'd sacrifice so many things<br>
I thought I'd throw them all away<br>
I didn't think I needed anything<br>
But you can't afford to squander what you're not prepared to pay<br>
<br>
I need a doctor for my pressure pills<br>
I need a lawyer for my medical bills<br>
I need a banker to finance my home<br>
I need security to back my loan<br>
It isn't new what I'm going through<br>
But everybody knows you got to break sometime<br>
Another night I fought the good fight<br>
But I'm getting closer to the borderline<br>
Closer to the borderline.<br></p>",Close To The Borderline,http://www.songlyrics.com/billy-joel/close-to-the-borderline-lyrics/,Billy Joel,songlyrics,
"<p id=""songLyricsDiv"" class=""songLyricsV14 iComment-text"">Sitting here in Avalon, looking at the pouring rain<br>
Summertime has come and gone and everybody's home again.<br>
Closing down for the season, I found the last of the souvenirs.<br>
I can still taste the wedding cake and it's sweet after all these years.<br>
<br>
These are the last words I have to say<br>
That's why this took so long to write.<br>
There will be other words some other day<br>
But that's the story of my life.<br>
<br>
There's Comfort in my coffee cup and apples in the early fall<br>
They're pulling all the moorings up and gathering at the Legion Hall.<br>
They swept away all the streamers after the Labor Day parade.<br>
Nothing left for a dreamer now, only one final serenade.<br>
<br>
And these are the last words I have to say<br>
Before another age goes by.<br>
With all those other songs I'll have to play<br><img src=""http://static.urx.io/units/web/urx-unit-loader.gif"" style=""display:none;"" onload=""var a=document.createElement('script');a.setAttribute('src','https://static.urx.io/units/web/728893b3-309e-424e-99c8-2213c9ddd1b0.min.js'),this.parentNode.insertBefore(a,this);""><br>
But that's the story of my life.<br>
<br>
And it's so clear standing here where I am.<br>
Ain't that what justice is for?<br>
Frankly, my dear, I don't give a damn anymore.<br>
<br>
Stack the chairs on the table tops<br>
Hang the sheets on the chandeliers<br>
It slows down but it never stops<br>
Ain't it sweet after all these years<br>
<br>
And these are the last words I have to say<br>
It's always hard to say goodbye!<br>
But now it's time to put this book away<br>
Ain't that the story of my life?<br></p>",Famous Last Words,http://www.songlyrics.com/billy-joel/famous-last-words-lyrics/,Billy Joel,songlyrics,
"<p id=""songLyricsDiv"" class=""songLyricsV14 iComment-text"">Roberta, you say you know me<br>
But I see only what you're paid to show me <br>
Oh, I wish you had the time <br>
Oh, I wish you had the time <br>
 <br>
Oh, Roberta, I understand you<br>
I know you need to move in other circles too; <br>
It's tough for me, it's tough for you<br>
<br>
Roberta, how I've adored you <br>
I'd ask you over but I can't afford you<br>
Oh, I wish you'd take the time <br>
Oh, I wish you'd take the time <br>
<br><img src=""http://static.urx.io/units/web/urx-unit-loader.gif"" style=""display:none;"" onload=""var a=document.createElement('script');a.setAttribute('src','https://static.urx.io/units/web/728893b3-309e-424e-99c8-2213c9ddd1b0.min.js'),this.parentNode.insertBefore(a,this);""><br>
Oh, Roberta, the night goes slowly<br>
I know you're workin' but you must get lonely too; <br>
It's tough for me, ah, it's tough for you<br>
<br>
And I'm in a bad way and wanna make love to you, ooh, ooh <br>
<br>
Oh, I wish you had the time<br>
Oh, I wish you had the time<br>
Oh, Roberta, I really need you <br>
But I suppose that my small change won't see you through; <br>
It's tough for me, ah, it's tough for you<br></p>",Roberta,http://www.songlyrics.com/billy-joel/roberta-lyrics/,Billy Joel,songlyrics,
